{
  "schema_version": 1,
  "id_type": "uint16",
  "reserved_ranges": [
    {
      "start": 0,
      "end": 999,
      "owner": "css_property"
    },
    {
      "start": 1000,
      "end": 1023,
      "owner": "element_construction_metadata"
    }
  ],
  "attributes": [
    {"id": 1024, "name": "accessibility-actions", "state": "active"},
    {"id": 1025, "name": "accessibility-element", "state": "active"},
    {"id": 1026, "name": "accessibility-elements-hidden", "state": "active"},
    {"id": 1027, "name": "accessibility-exclusive-focus", "state": "active"},
    {"id": 1028, "name": "accessibility-heading", "state": "active"},
    {"id": 1029, "name": "accessibility-label", "state": "active"},
    {"id": 1030, "name": "accessibility-role-description", "state": "active"},
    {"id": 1031, "name": "accessibility-traits", "state": "active"},
    {"id": 1032, "name": "accessibility-value", "state": "active"},
    {"id": 1033, "name": "allow-break-around-punctuation", "state": "active"},
    {"id": 1034, "name": "android-always-overscroll", "state": "active"},
    {"id": 1035, "name": "android-capture-target", "state": "active"},
    {"id": 1036, "name": "android-emoji-compat", "state": "active"},
    {"id": 1037, "name": "android-force-can-scroll", "state": "active"},
    {"id": 1038, "name": "android-fullscreen-mode", "state": "active"},
    {"id": 1039, "name": "android-navigation-bar-style", "state": "active"},
    {"id": 1040, "name": "android-nested-scroll-as-child", "state": "active"},
    {"id": 1041, "name": "animation", "state": "active"},
    {"id": 1042, "name": "animation-frame-rate", "state": "active"},
    {"id": 1043, "name": "animation-type", "state": "active"},
    {"id": 1044, "name": "animation-velocity", "state": "active"},
    {"id": 1045, "name": "auto-height", "state": "active"},
    {"id": 1046, "name": "auto-size", "state": "active"},
    {"id": 1047, "name": "auto-width", "state": "active"},
    {"id": 1048, "name": "autoplay", "state": "active"},
    {"id": 1049, "name": "block-native-event", "state": "active"},
    {"id": 1050, "name": "block-native-event-areas", "state": "active"},
    {"id": 1051, "name": "blur-effect", "state": "active"},
    {"id": 1052, "name": "blur-radius", "state": "active"},
    {"id": 1053, "name": "blur-sampling", "state": "active"},
    {"id": 1054, "name": "bounces", "state": "active"},
    {"id": 1055, "name": "cap-insets", "state": "active"},
    {"id": 1056, "name": "cap-insets-scale", "state": "active"},
    {"id": 1057, "name": "confirm-type", "state": "active"},
    {"id": 1058, "name": "consume-slide-event", "state": "active"},
    {"id": 1059, "name": "content", "state": "active"},
    {"id": 1060, "name": "content-complete", "state": "active"},
    {"id": 1061, "name": "content-id", "state": "active"},
    {"id": 1062, "name": "content-range", "state": "active"},
    {"id": 1063, "name": "cookies", "state": "active"},
    {"id": 1064, "name": "cssAlignWithLegacyW3C", "state": "active"},
    {"id": 1065, "name": "current-color", "state": "active"},
    {"id": 1066, "name": "custom-context-menu", "state": "active"},
    {"id": 1067, "name": "custom-text-selection", "state": "active"},
    {"id": 1068, "name": "data", "state": "active"},
    {"id": 1069, "name": "default-value", "state": "active"},
    {"id": 1070, "name": "defer-src-invalidation", "state": "active"},
    {"id": 1071, "name": "disabled", "state": "active"},
    {"id": 1072, "name": "drop-shadow", "state": "active"},
    {"id": 1073, "name": "enable-auto-blur", "state": "active"},
    {"id": 1074, "name": "enable-break-around-punctuation", "state": "active"},
    {"id": 1075, "name": "enable-debug", "state": "active"},
    {"id": 1076, "name": "enable-drag", "state": "active"},
    {"id": 1077, "name": "enable-exposure-ui-clip", "state": "active"},
    {"id": 1078, "name": "enable-exposure-ui-margin", "state": "active"},
    {"id": 1079, "name": "enable-font-scaling", "state": "active"},
    {"id": 1080, "name": "enable-insert-platform-view-operation", "state": "active"},
    {"id": 1081, "name": "enable-multi-async-thread", "state": "active"},
    {"id": 1082, "name": "enable-nested-scroll", "state": "active"},
    {"id": 1083, "name": "enable-refresh", "state": "active"},
    {"id": 1084, "name": "enable-scroll", "state": "active"},
    {"id": 1085, "name": "enable-scroll-bar", "state": "active"},
    {"id": 1086, "name": "enable-selection", "state": "active"},
    {"id": 1087, "name": "enable-touch-pseudo-propagation", "state": "active"},
    {"id": 1088, "name": "enableLayoutOnly", "state": "active"},
    {"id": 1089, "name": "estimated-main-axis-size-px", "state": "active"},
    {"id": 1090, "name": "event-through", "state": "active"},
    {"id": 1091, "name": "event-through-active-regions", "state": "active"},
    {"id": 1092, "name": "experimental-android-enable-new-overflow", "state": "active"},
    {"id": 1093, "name": "experimental-recycle-sticky-item", "state": "tombstone"},
    {"id": 1094, "name": "experimental-search-ref-anchor-strategy", "state": "active"},
    {"id": 1095, "name": "experimental-update-blur-radius", "state": "active"},
    {"id": 1096, "name": "exposure-area", "state": "active"},
    {"id": 1097, "name": "exposure-id", "state": "active"},
    {"id": 1098, "name": "exposure-scene", "state": "active"},
    {"id": 1099, "name": "exposure-screen-margin-bottom", "state": "active"},
    {"id": 1100, "name": "exposure-screen-margin-left", "state": "active"},
    {"id": 1101, "name": "exposure-screen-margin-right", "state": "active"},
    {"id": 1102, "name": "exposure-screen-margin-top", "state": "active"},
    {"id": 1103, "name": "exposure-ui-margin-bottom", "state": "active"},
    {"id": 1104, "name": "exposure-ui-margin-left", "state": "active"},
    {"id": 1105, "name": "exposure-ui-margin-right", "state": "active"},
    {"id": 1106, "name": "exposure-ui-margin-top", "state": "active"},
    {"id": 1107, "name": "flatten", "state": "active"},
    {"id": 1108, "name": "focus-index", "state": "active"},
    {"id": 1109, "name": "focusable", "state": "active"},
    {"id": 1110, "name": "full-span", "state": "active"},
    {"id": 1111, "name": "glass-interactive", "state": "active"},
    {"id": 1112, "name": "glass-style", "state": "active"},
    {"id": 1113, "name": "glass-tint-color", "state": "active"},
    {"id": 1114, "name": "global-props", "state": "active"},
    {"id": 1115, "name": "granularity", "state": "active"},
    {"id": 1116, "name": "harmony-scroll-edge-effect", "state": "active"},
    {"id": 1117, "name": "header-over-slot", "state": "active"},
    {"id": 1118, "name": "hidden", "state": "active"},
    {"id": 1119, "name": "hit-slop", "state": "active"},
    {"id": 1120, "name": "html", "state": "active"},
    {"id": 1121, "name": "ignore-focus", "state": "active"},
    {"id": 1122, "name": "image-config", "state": "active"},
    {"id": 1123, "name": "include-font-padding", "state": "active"},
    {"id": 1124, "name": "initial-animation-step", "state": "active"},
    {"id": 1125, "name": "initial-scroll-index", "state": "active"},
    {"id": 1126, "name": "initial-scroll-offset", "state": "active"},
    {"id": 1127, "name": "initial-scroll-to-index", "state": "active"},
    {"id": 1128, "name": "initial-select-index", "state": "active"},
    {"id": 1129, "name": "initjs", "state": "active"},
    {"id": 1130, "name": "input-filter", "state": "active"},
    {"id": 1131, "name": "ios-auto-correct", "state": "active"},
    {"id": 1132, "name": "ios-background-shape-layer", "state": "active"},
    {"id": 1133, "name": "ios-enable-simultaneous-touch", "state": "active"},
    {"id": 1134, "name": "ios-enable-swipe-back", "state": "active"},
    {"id": 1135, "name": "ios-force-scroll-detach", "state": "active"},
    {"id": 1136, "name": "ios-gesture-direction", "state": "active"},
    {"id": 1137, "name": "ios-gesture-offset", "state": "active"},
    {"id": 1138, "name": "ios-pan-intercept-gesture-class", "state": "active"},
    {"id": 1139, "name": "ios-pan-intercept-view-class", "state": "active"},
    {"id": 1140, "name": "ios-pan-intercept-view-tag", "state": "active"},
    {"id": 1141, "name": "ios-platform-accessibility-id", "state": "active"},
    {"id": 1142, "name": "ios-recognized-gesture-class", "state": "active"},
    {"id": 1143, "name": "ios-recognized-view-tag", "state": "active"},
    {"id": 1144, "name": "ios-scrolls-to-top", "state": "active"},
    {"id": 1145, "name": "ios-spell-check", "state": "active"},
    {"id": 1146, "name": "ios-user-interface-style", "state": "active"},
    {"id": 1147, "name": "is", "state": "active"},
    {"id": 1148, "name": "item-key", "state": "active"},
    {"id": 1149, "name": "item-snap", "state": "active"},
    {"id": 1150, "name": "keep-item-view", "state": "active"},
    {"id": 1151, "name": "layout-id", "state": "active"},
    {"id": 1152, "name": "level", "state": "active"},
    {"id": 1153, "name": "line-spacing", "state": "active"},
    {"id": 1154, "name": "list-type", "state": "active"},
    {"id": 1155, "name": "loop", "state": "active"},
    {"id": 1156, "name": "loop-count", "state": "active"},
    {"id": 1157, "name": "lower-threshold", "state": "active"},
    {"id": 1158, "name": "lower-threshold-item-count", "state": "active"},
    {"id": 1159, "name": "markdown-effect", "state": "active"},
    {"id": 1160, "name": "markdown-style", "state": "active"},
    {"id": 1161, "name": "maxlength", "state": "active"},
    {"id": 1162, "name": "maxlines", "state": "active"},
    {"id": 1163, "name": "mode", "state": "active"},
    {"id": 1164, "name": "moveable", "state": "active"},
    {"id": 1165, "name": "muted", "state": "active"},
    {"id": 1166, "name": "name", "state": "active"},
    {"id": 1167, "name": "native-interaction-enabled", "state": "active"},
    {"id": 1168, "name": "need-layout-complete-info", "state": "active"},